{
  "schemaVersion": 1,
  "id": "example-keelhaul-listing",
  "name": "Example: Keelhaul Listing",
  "author": "Phobos A. D'thorga",
  "version": "1.3.0",
  "idPrefix": "keelhaul",
  "requires": {
    "PhobosFramework": "0.132.0",
    "PhobosExchange": "0.5.0"
  },
  "notes": "Kept in the Phobos Ostranauts repository as the worked example of a company listed on Phobos Exchange with its own story: news that moves its price, a letter when the player first buys in, and a history before the game that shapes its price chart. Loaded by the repository's checks."
}
