{
  "schemaVersion": 1,
  "id": "example-richer-gangue",
  "name": "Example: Richer Gangue",
  "author": "Phobos A. D'thorga",
  "version": "1.1.0",
  "idPrefix": "richergangue",
  "requires": {
    "PhobosFramework": "0.92.0",
    "PhobosManufacturing": "0.45.0"
  },
  "notes": "Kept in the Phobos Ostranauts repository as the worked example for docs/publishing-an-add-on.md, and loaded by its checks."
}
